{
  "conditional_report_paths": [
    "study_docs/research/ductile-origami-warmstart/reports/m00-study-contract-observability-report.md"
  ],
  "generated_roots": [
    "agent_run/260724-ductile-origami-warmstart-sequential/milestones/m00/evidence/impl",
    "agent_run/260724-ductile-origami-warmstart-sequential/milestones/m00/evidence/verifier"
  ],
  "implementation_paths": [
    "agent_run/260724-ductile-origami-warmstart-sequential/milestones/m00/impl_report.md",
    "projects/hipblaslt/tensilelite/Tensile/Tests/unit/DuctileM00/__init__.py",
    "projects/hipblaslt/tensilelite/Tensile/Tests/unit/DuctileM00/test_contract_and_lock.py",
    "projects/hipblaslt/tensilelite/Tensile/Tests/unit/DuctileM00/test_observer_semantics.py",
    "projects/hipblaslt/tensilelite/Tensile/Tests/unit/DuctileM00/test_reconciliation.py",
    "projects/hipblaslt/tensilelite/Tensile/Tests/unit/DuctileM00/test_runner_e2e.py",
    "projects/hipblaslt/tensilelite/Tensile/Tests/unit/DuctileM00/test_scope_and_report_lifecycle.py",
    "projects/hipblaslt/tensilelite/Tensile/Tests/unit/DuctileM00/test_split_and_baseline_guards.py",
    "projects/hipblaslt/tensilelite/Tensile/ductile/__init__.py",
    "projects/hipblaslt/tensilelite/Tensile/ductile/algorithm/__init__.py",
    "projects/hipblaslt/tensilelite/Tensile/ductile/algorithm/ga.py",
    "projects/hipblaslt/tensilelite/Tensile/ductile/config/__init__.py",
    "projects/hipblaslt/tensilelite/Tensile/ductile/config/defaults.yaml",
    "projects/hipblaslt/tensilelite/Tensile/ductile/core/__init__.py",
    "projects/hipblaslt/tensilelite/Tensile/ductile/core/crossover.py",
    "projects/hipblaslt/tensilelite/Tensile/ductile/core/mating.py",
    "projects/hipblaslt/tensilelite/Tensile/ductile/core/mutation.py",
    "projects/hipblaslt/tensilelite/Tensile/ductile/core/population.py",
    "projects/hipblaslt/tensilelite/Tensile/ductile/core/selection.py",
    "projects/hipblaslt/tensilelite/Tensile/ductile/core/space.py",
    "projects/hipblaslt/tensilelite/Tensile/ductile/core/survival.py",
    "projects/hipblaslt/tensilelite/Tensile/ductile/m00/__init__.py",
    "projects/hipblaslt/tensilelite/Tensile/ductile/m00/artifacts.py",
    "projects/hipblaslt/tensilelite/Tensile/ductile/m00/canonical.py",
    "projects/hipblaslt/tensilelite/Tensile/ductile/m00/contract.py",
    "projects/hipblaslt/tensilelite/Tensile/ductile/m00/events.py",
    "projects/hipblaslt/tensilelite/Tensile/ductile/m00/reconcile.py",
    "projects/hipblaslt/tensilelite/Tensile/ductile/m00/registries.py",
    "projects/hipblaslt/tensilelite/Tensile/ductile/m00/report.py",
    "projects/hipblaslt/tensilelite/Tensile/ductile/m00/runner.py",
    "projects/hipblaslt/tensilelite/Tensile/ductile/m00/scope.py",
    "projects/hipblaslt/tensilelite/Tensile/ductile/utils/__init__.py",
    "projects/hipblaslt/tensilelite/Tensile/ductile/utils/logger.py",
    "projects/hipblaslt/tensilelite/pyproject.toml",
    "projects/hipblaslt/tensilelite/requirements.txt",
    "study_docs/research/ductile-origami-warmstart/protocol/amendment-chain.jsonl",
    "study_docs/research/ductile-origami-warmstart/protocol/baseline-registry.json",
    "study_docs/research/ductile-origami-warmstart/protocol/experiment-contract.yaml",
    "study_docs/research/ductile-origami-warmstart/protocol/m00-whitelist.json",
    "study_docs/research/ductile-origami-warmstart/protocol/protocol-lock.json",
    "study_docs/research/ductile-origami-warmstart/protocol/revision-registry.json",
    "study_docs/research/ductile-origami-warmstart/protocol/schemas/amendment.schema.json",
    "study_docs/research/ductile-origami-warmstart/protocol/schemas/baseline-registry.schema.json",
    "study_docs/research/ductile-origami-warmstart/protocol/schemas/benchmark-observation.schema.json",
    "study_docs/research/ductile-origami-warmstart/protocol/schemas/checkpoint-metadata.schema.json",
    "study_docs/research/ductile-origami-warmstart/protocol/schemas/environment.schema.json",
    "study_docs/research/ductile-origami-warmstart/protocol/schemas/experiment-contract.schema.json",
    "study_docs/research/ductile-origami-warmstart/protocol/schemas/ga-event.schema.json",
    "study_docs/research/ductile-origami-warmstart/protocol/schemas/generated-input.schema.json",
    "study_docs/research/ductile-origami-warmstart/protocol/schemas/m00-whitelist.schema.json",
    "study_docs/research/ductile-origami-warmstart/protocol/schemas/protocol-lock.schema.json",
    "study_docs/research/ductile-origami-warmstart/protocol/schemas/revision-registry.schema.json",
    "study_docs/research/ductile-origami-warmstart/protocol/schemas/run-manifest.schema.json",
    "study_docs/research/ductile-origami-warmstart/protocol/schemas/search-space.schema.json",
    "study_docs/research/ductile-origami-warmstart/protocol/schemas/shape-registry.schema.json",
    "study_docs/research/ductile-origami-warmstart/protocol/schemas/summary.schema.json",
    "study_docs/research/ductile-origami-warmstart/protocol/schemas/verifier-attestation.schema.json",
    "study_docs/research/ductile-origami-warmstart/protocol/shape-registry.csv"
  ],
  "parent_commit": "8ff9ef002457ac4f11f5f5fe3f60c858d554806c",
  "planning_paths": [
    "agent_run/260724-ductile-origami-warmstart-sequential/milestones/m00/baseline.md",
    "agent_run/260724-ductile-origami-warmstart-sequential/milestones/m00/plan_a.md"
  ],
  "protected_paths": [
    ".claude/skills/implement-verify-loop/SKILL.md",
    ".cursor/rules/hipblaslt-onboarding.mdc",
    ".cursor/skills/implement-verify-loop/SKILL.md",
    "CLAUDE.md",
    "AGENTS.md",
    ".agents/skills/design-discussion/SKILL.md",
    ".agents/skills/hipblaslt-code-trace/SKILL.md",
    ".agents/skills/implement-verify-loop/SKILL.md",
    ".agents/skills/learning-notes/SKILL.md",
    ".agents/skills/learning-quiz/SKILL.md",
    ".agents/skills/learning-roadmap-authoring/SKILL.md"
  ],
  "schema_version": "1.0",
  "source_set_paths": [
    "projects/hipblaslt/tensilelite/Tensile/Tests/unit/DuctileM00/__init__.py",
    "projects/hipblaslt/tensilelite/Tensile/Tests/unit/DuctileM00/test_contract_and_lock.py",
    "projects/hipblaslt/tensilelite/Tensile/Tests/unit/DuctileM00/test_observer_semantics.py",
    "projects/hipblaslt/tensilelite/Tensile/Tests/unit/DuctileM00/test_reconciliation.py",
    "projects/hipblaslt/tensilelite/Tensile/Tests/unit/DuctileM00/test_runner_e2e.py",
    "projects/hipblaslt/tensilelite/Tensile/Tests/unit/DuctileM00/test_scope_and_report_lifecycle.py",
    "projects/hipblaslt/tensilelite/Tensile/Tests/unit/DuctileM00/test_split_and_baseline_guards.py",
    "projects/hipblaslt/tensilelite/Tensile/ductile/__init__.py",
    "projects/hipblaslt/tensilelite/Tensile/ductile/algorithm/__init__.py",
    "projects/hipblaslt/tensilelite/Tensile/ductile/algorithm/ga.py",
    "projects/hipblaslt/tensilelite/Tensile/ductile/config/__init__.py",
    "projects/hipblaslt/tensilelite/Tensile/ductile/config/defaults.yaml",
    "projects/hipblaslt/tensilelite/Tensile/ductile/core/__init__.py",
    "projects/hipblaslt/tensilelite/Tensile/ductile/core/crossover.py",
    "projects/hipblaslt/tensilelite/Tensile/ductile/core/mating.py",
    "projects/hipblaslt/tensilelite/Tensile/ductile/core/mutation.py",
    "projects/hipblaslt/tensilelite/Tensile/ductile/core/population.py",
    "projects/hipblaslt/tensilelite/Tensile/ductile/core/selection.py",
    "projects/hipblaslt/tensilelite/Tensile/ductile/core/space.py",
    "projects/hipblaslt/tensilelite/Tensile/ductile/core/survival.py",
    "projects/hipblaslt/tensilelite/Tensile/ductile/m00/__init__.py",
    "projects/hipblaslt/tensilelite/Tensile/ductile/m00/artifacts.py",
    "projects/hipblaslt/tensilelite/Tensile/ductile/m00/canonical.py",
    "projects/hipblaslt/tensilelite/Tensile/ductile/m00/contract.py",
    "projects/hipblaslt/tensilelite/Tensile/ductile/m00/events.py",
    "projects/hipblaslt/tensilelite/Tensile/ductile/m00/reconcile.py",
    "projects/hipblaslt/tensilelite/Tensile/ductile/m00/registries.py",
    "projects/hipblaslt/tensilelite/Tensile/ductile/m00/report.py",
    "projects/hipblaslt/tensilelite/Tensile/ductile/m00/runner.py",
    "projects/hipblaslt/tensilelite/Tensile/ductile/m00/scope.py",
    "projects/hipblaslt/tensilelite/Tensile/ductile/utils/__init__.py",
    "projects/hipblaslt/tensilelite/Tensile/ductile/utils/logger.py",
    "projects/hipblaslt/tensilelite/pyproject.toml",
    "projects/hipblaslt/tensilelite/requirements.txt"
  ]
}
